{
  "schema_version": 1,
  "bpm": 100,
  "duration_sec": 249.5,
  "time_signature": "4/4",
  "tracks": [
    {
      "index": 0,
      "name": "Left Hand (Bass & Accompaniment)",
      "note_count": 467
    },
    {
      "index": 1,
      "name": "Right Hand (Cantabile Melody)",
      "note_count": 313
    }
  ],
  "notes": [
    {
      "id": 1,
      "pitch": 40,
      "name": "E2",
      "velocity": 48,
      "start": 0,
      "end": 2.28,
      "duration": 2.28,
      "track": 0,
      "hand": "L"
    },
    {
      "id": 2,
      "pitch": 47,
      "name": "B2",
      "velocity": 42,
      "start": 0,
      "end": 1.08,
      "duration": 1.08,
      "track": 0,
      "hand": "L"
    },
    {
      "id": 3,
      "pitch": 55,
      "name": "G3",
      "velocity": 40,
      "start": 0,
      "end": 1.08,
      "duration": 1.08,
      "track": 0,
      "hand": "L"
    },
    {
      "id": 4,
      "pitch": 79,
      "name": "G5",
      "velocity": 76,
      "start": 0,
      "end": 1.71,
      "duration": 1.71,
      "track": 1,
      "hand": "R"
    },
    {
      "id": 5,
      "pitch": 47,
      "name": "B2",
      "velocity": 42,
      "start": 0.6,
      "end": 1.14,
      "duration": 0.54,
      "track": 0,
      "hand": "L"
    },
    {
      "id": 6,
      "pitch": 52,
      "name": "E3",
      "velocity": 42,
      "start": 1.2,
      "end": 1.74,
      "duration": 0.54,
      "track": 0,
      "hand": "L"
    },
    {
      "id": 7,
      "pitch": 55,
      "name": "G3",
      "velocity": 42,
      "start": 1.8,
      "end": 2.34,
      "duration": 0.54,
      "track": 0,
      "hand": "L"
    },
    {
      "id": 8,
      "pitch": 88,
      "name": "E6",
      "velocity": 74,
      "start": 1.8,
      "end": 2.34,
      "duration": 0.54,
      "track": 1,
      "hand": "R"
    },
    {
      "id": 9,
      "pitch": 48,
      "name": "C3",
      "velocity": 48,
      "start": 2.4,
      "end": 4.68,
      "duration": 2.28,
      "track": 0,
      "hand": "L"
    },
    {
      "id": 10,
      "pitch": 91,
      "name": "G6",
      "velocity": 76,
      "start": 2.4,
      "end": 2.94,
      "duration": 0.54,
      "track": 1,
      "hand": "R"
    },
    {
      "id": 11,
      "pitch": 55,
      "name": "G3",
      "velocity": 42,
      "start": 3,
      "end": 3.54,
      "duration": 0.54,
      "track": 0,
      "hand": "L"
    },
    {
      "id": 12,
      "pitch": 88,
      "name": "E6",
      "velocity": 74,
      "start": 3,
      "end": 3.54,
      "duration": 0.54,
      "track": 1,
      "hand": "R"
    },
    {
      "id": 13,
      "pitch": 60,
      "name": "C4",
      "velocity": 42,
      "start": 3.6,
      "end": 4.14,
      "duration": 0.54,
      "track": 0,
      "hand": "L"
    },
    {
      "id": 14,
      "pitch": 88,
      "name": "E6",
      "velocity": 72,
      "start": 3.6,
      "end": 3.87,
      "duration": 0.27,
      "track": 1,
      "hand": "R"
    },
    {
      "id": 15,
      "pitch": 88,
      "name": "E6",
      "velocity": 74,
      "start": 3.9,
      "end": 4.17,
      "duration": 0.27,
      "track": 1,
      "hand": "R"
    },
    {
      "id": 16,
      "pitch": 64,
      "name": "E4",
      "velocity": 42,
      "start": 4.2,
      "end": 4.74,
      "duration": 0.54,
      "track": 0,
      "hand": "L"
    },
    {
      "id": 17,
      "pitch": 45,
      "name": "A2",
      "velocity": 48,
      "start": 4.8,
      "end": 7.08,
      "duration": 2.28,
      "track": 0,
      "hand": "L"
    },
    {
      "id": 18,
      "pitch": 93,
      "name": "A6",
      "velocity": 78,
      "start": 4.8,
      "end": 5.34,
      "duration": 0.54,
      "track": 1,
      "hand": "R"
    },
    {
      "id": 19,
      "pitch": 52,
      "name": "E3",
      "velocity": 42,
      "start": 5.4,
      "end": 5.94,
      "duration": 0.54,
      "track": 0,
      "hand": "L"
    },
    {
      "id": 20,
      "pitch": 83,
      "name": "B5",
      "velocity": 76,
      "start": 5.4,
      "end": 5.94,
      "duration": 0.54,
      "track": 1,
      "hand": "R"
    },
    {
      "id": 21,
      "pitch": 57,
      "name": "A3",
      "velocity": 42,
      "start": 6,
      "end": 6.54,
      "duration": 0.54,
      "track": 0,
      "hand": "L"
    },
    {
      "id": 22,
      "pitch": 88,
      "name": "E6",
      "velocity": 74,
      "start": 6,
      "end": 6.54,
      "duration": 0.54,
      "track": 1,
      "hand": "R"
    },
    {
      "id": 23,
      "pitch": 60,
      "name": "C4",
      "velocity": 42,
      "start": 6.6,
      "end": 7.14,
      "duration": 0.54,
      "track": 0,
      "hand": "L"
    },
    {
      "id": 24,
      "pitch": 88,
      "name": "E6",
      "velocity": 74,
      "start": 6.6,
      "end": 7.14,
      "duration": 0.54,
      "track": 1,
      "hand": "R"
    },
    {
      "id": 25,
      "pitch": 47,
      "name": "B2",
      "velocity": 48,
      "start": 7.2,
      "end": 9.48,
      "duration": 2.28,
      "track": 0,
      "hand": "L"
    },
    {
      "id": 26,
      "pitch": 90,
      "name": "F#6",
      "velocity": 76,
      "start": 7.2,
      "end": 8.34,
      "duration": 1.14,
      "track": 1,
      "hand": "R"
    },
    {
      "id": 27,
      "pitch": 54,
      "name": "F#3",
      "velocity": 42,
      "start": 7.8,
      "end": 8.34,
      "duration": 0.54,
      "track": 0,
      "hand": "L"
    },
    {
      "id": 28,
      "pitch": 59,
      "name": "B3",
      "velocity": 42,
      "start": 8.4,
      "end": 8.94,
      "duration": 0.54,
      "track": 0,
      "hand": "L"
    },
    {
      "id": 29,
      "pitch": 86,
      "name": "D6",
      "velocity": 72,
      "start": 8.4,
      "end": 9.51,
      "duration": 1.11,
      "track": 1,
      "hand": "R"
    },
    {
      "id": 30,
      "pitch": 62,
      "name": "D4",
      "velocity": 42,
      "start": 9,
      "end": 9.54,
      "duration": 0.54,
      "track": 0,
      "hand": "L"
    },
    {
      "id": 31,
      "pitch": 40,
      "name": "E2",
      "velocity": 48,
      "start": 9.6,
      "end": 11.88,
      "duration": 2.28,
      "track": 0,
      "hand": "L"
    },
    {
      "id": 32,
      "pitch": 47,
      "name": "B2",
      "velocity": 42,
      "start": 9.6,
      "end": 10.68,
      "duration": 1.08,
      "track": 0,
      "hand": "L"
    },
    {
      "id": 33,
      "pitch": 55,
      "name": "G3",
      "velocity": 40,
      "start": 9.6,
      "end": 10.68,
      "duration": 1.08,
      "track": 0,
      "hand": "L"
    },
    {
      "id": 34,
      "pitch": 79,
      "name": "G5",
      "velocity": 76,
      "start": 9.6,
      "end": 11.31,
      "duration": 1.71,
      "track": 1,
      "hand": "R"
    },
    {
      "id": 35,
      "pitch": 47,
      "name": "B2",
      "velocity": 42,
      "start": 10.2,
      "end": 10.74,
      "duration": 0.54,
      "track": 0,
      "hand": "L"
    },
    {
      "id": 36,
      "pitch": 52,
      "name": "E3",
      "velocity": 42,
      "start": 10.8,
      "end": 11.34,
      "duration": 0.54,
      "track": 0,
      "hand": "L"
    },
    {
      "id": 37,
      "pitch": 55,
      "name": "G3",
      "velocity": 42,
      "start": 11.4,
      "end": 11.94,
      "duration": 0.54,
      "track": 0,
      "hand": "L"
    },
    {
      "id": 38,
      "pitch": 83,
      "name": "B5",
      "velocity": 74,
      "start": 11.4,
      "end": 11.94,
      "duration": 0.54,
      "track": 1,
      "hand": "R"
    },
    {
      "id": 39,
      "pitch": 48,
      "name": "C3",
      "velocity": 48,
      "start": 12,
      "end": 14.28,
      "duration": 2.28,
      "track": 0,
      "hand": "L"
    },
    {
      "id": 40,
      "pitch": 91,
      "name": "G6",
      "velocity": 76,
      "start": 12,
      "end": 12.54,
      "duration": 0.54,
      "track": 1,
      "hand": "R"
    },
    {
      "id": 41,
      "pitch": 55,
      "name": "G3",
      "velocity": 42,
      "start": 12.6,
      "end": 13.14,
      "duration": 0.54,
      "track": 0,
      "hand": "L"
    },
    {
      "id": 42,
      "pitch": 88,
      "name": "E6",
      "velocity": 74,
      "start": 12.6,
      "end": 13.14,
      "duration": 0.54,
      "track": 1,
      "hand": "R"
    },
    {
      "id": 43,
      "pitch": 60,
      "name": "C4",
      "velocity": 42,
      "start": 13.2,
      "end": 13.74,
      "duration": 0.54,
      "track": 0,
      "hand": "L"
    },
    {
      "id": 44,
      "pitch": 88,
      "name": "E6",
      "velocity": 72,
      "start": 13.2,
      "end": 13.47,
      "duration": 0.27,
      "track": 1,
      "hand": "R"
    },
    {
      "id": 45,
      "pitch": 88,
      "name": "E6",
      "velocity": 74,
      "start": 13.5,
      "end": 13.77,
      "duration": 0.27,
      "track": 1,
      "hand": "R"
    },
    {
      "id": 46,
      "pitch": 64,
      "name": "E4",
      "velocity": 42,
      "start": 13.8,
      "end": 14.34,
      "duration": 0.54,
      "track": 0,
      "hand": "L"
    },
    {
      "id": 47,
      "pitch": 45,
      "name": "A2",
      "velocity": 48,
      "start": 14.4,
      "end": 16.68,
      "duration": 2.28,
      "track": 0,
      "hand": "L"
    },
    {
      "id": 48,
      "pitch": 95,
      "name": "B6",
      "velocity": 78,
      "start": 14.4,
      "end": 14.94,
      "duration": 0.54,
      "track": 1,
      "hand": "R"
    },
    {
      "id": 49,
      "pitch": 52,
      "name": "E3",
      "velocity": 42,
      "start": 15,
      "end": 15.54,
      "duration": 0.54,
      "track": 0,
      "hand": "L"
    },
    {
      "id": 50,
      "pitch": 84,
      "name": "C6",
      "velocity": 76,
      "start": 15,
      "end": 15.54,
      "duration": 0.54,
      "track": 1,
      "hand": "R"
    },
    {
      "id": 51,
      "pitch": 57,
      "name": "A3",
      "velocity": 42,
      "start": 15.6,
      "end": 16.14,
      "duration": 0.54,
      "track": 0,
      "hand": "L"
    },
    {
      "id": 52,